{
  "$schema": "https://json-schema.org/draft/2020-12/schema",
  "$id": "https://inferharness.local/schemas/benchmark/model_snapshot.schema.json",
  "title": "Benchmark ModelSnapshot",
  "description": "Observed model and inference-server state captured at benchmark instantiation time. The shape uses canonical backend model and inference-server object names instead of benchmark-only serving or capability aliases.",
  "type": "object",
  "additionalProperties": false,
  "required": [
    "kind",
    "schema_version",
    "model",
    "identity",
    "architecture",
    "inference_server",
    "runtime",
    "endpoints",
    "auth",
    "capabilities",
    "discovery",
    "raw",
    "snapshot_quality"
  ],
  "properties": {
    "kind": { "type": "string", "const": "model_snapshot" },
    "schema_version": { "type": "string", "const": "benchmark_model_snapshot_v1" },
    "model": { "$ref": "#/$defs/modelRecord" },
    "identity": { "$ref": "#/$defs/modelIdentity" },
    "architecture": { "$ref": "#/$defs/modelArchitecture" },
    "modalities": { "$ref": "#/$defs/modelModalities" },
    "model_capabilities": { "$ref": "#/$defs/modelCapabilities" },
    "limits": { "$ref": "#/$defs/modelLimits" },
    "performance": { "$ref": "#/$defs/modelPerformance" },
    "configuration": { "$ref": "#/$defs/modelConfiguration" },
    "inference_server": { "$ref": "#/$defs/inferenceServerRecord" },
    "runtime": { "$ref": "#/$defs/serverRuntime" },
    "endpoints": { "$ref": "#/$defs/serverEndpoints" },
    "auth": { "$ref": "#/$defs/serverAuth" },
    "capabilities": { "$ref": "#/$defs/serverCapabilities" },
    "discovery": { "$ref": "#/$defs/serverDiscovery" },
    "raw": { "type": "object", "additionalProperties": true },
    "model_metadata": { "type": "object", "additionalProperties": true },
    "snapshot_quality": {
      "type": "object",
      "additionalProperties": false,
      "required": ["completeness", "sources", "warnings"],
      "properties": {
        "completeness": { "type": "string", "enum": ["complete", "partial", "minimal", "unknown"] },
        "sources": {
          "type": "array",
          "items": {
            "type": "string",
            "enum": ["provider_api", "server_config", "model_file_metadata", "model_name_parse", "user_declared", "heuristic", "unknown"]
          },
          "uniqueItems": true
        },
        "warnings": { "type": "array", "items": { "type": "string" } }
      }
    }
  },
  "$defs": {
    "modelRecord": {
      "type": "object",
      "additionalProperties": false,
      "required": ["model_id", "server_id", "display_name", "base_model_name"],
      "properties": {
        "model_id": { "type": "string", "minLength": 1 },
        "server_id": { "type": "string", "minLength": 1 },
        "display_name": { "type": "string", "minLength": 1 },
        "base_model_name": { "type": ["string", "null"] },
        "active": { "type": "boolean" },
        "archived": { "type": "boolean" },
        "created_at": { "type": "string" },
        "updated_at": { "type": "string" },
        "archived_at": { "type": ["string", "null"] }
      }
    },
    "modelIdentity": {
      "type": "object",
      "additionalProperties": false,
      "required": ["provider", "family", "version", "revision", "checksum", "quantized_provider"],
      "properties": {
        "provider": {
          "type": "string",
          "enum": ["openai", "meta", "mistral", "qwen", "google", "moonshot", "cohere", "deepseek", "anthropic", "nvidia", "zai", "custom", "unknown"]
        },
        "family": { "type": ["string", "null"] },
        "version": { "type": ["string", "null"] },
        "revision": { "type": ["string", "null"] },
        "checksum": { "type": ["string", "null"] },
        "quantized_provider": { "type": ["string", "null"] }
      }
    },
    "modelArchitecture": {
      "type": "object",
      "additionalProperties": false,
      "required": ["type", "parameter_count", "precision", "quantisation"],
      "properties": {
        "type": { "type": "string", "enum": ["decoder-only", "encoder-decoder", "other", "unknown"] },
        "parameter_count": { "type": ["number", "null"] },
        "parameter_count_label": { "type": ["string", "null"] },
        "active_parameter_label": { "type": ["string", "null"] },
        "precision": { "type": "string", "enum": ["fp32", "fp16", "bf16", "int8", "int4", "mixed", "unknown"] },
        "quantisation": {
          "type": "object",
          "additionalProperties": false,
          "required": ["method", "bits", "group_size"],
          "properties": {
            "method": { "type": "string", "enum": ["gguf", "gptq", "awq", "mlx", "none", "unknown"] },
            "bits": { "type": ["number", "null"] },
            "group_size": { "type": ["number", "null"] },
            "scheme": { "type": ["string", "null"], "enum": ["k-quant", "legacy", "tensorwise", "unknown", null] },
            "variant": { "type": ["string", "null"], "enum": ["S", "M", "L", null] },
            "weight_format": { "type": ["string", "null"] }
          }
        },
        "format": { "type": ["string", "null"], "enum": ["MLX", "GGUF", "GPTQ", "AWQ", "SafeTensors", null] }
      }
    },
    "modelModalities": {
      "type": "object",
      "additionalProperties": false,
      "required": ["input", "output"],
      "properties": {
        "input": { "type": "array", "items": { "type": "string" } },
        "output": { "type": "array", "items": { "type": "string" } }
      }
    },
    "modelCapabilities": {
      "type": "object",
      "additionalProperties": false,
      "required": ["generation", "multimodal", "reasoning"],
      "properties": {
        "generation": {
          "type": "object",
          "additionalProperties": false,
          "required": ["text", "json_schema_output", "tools", "embeddings"],
          "properties": {
            "text": { "type": "boolean" },
            "json_schema_output": { "type": "boolean" },
            "tools": { "type": "boolean" },
            "embeddings": { "type": "boolean" }
          }
        },
        "multimodal": {
          "type": "object",
          "additionalProperties": false,
          "required": ["vision", "audio"],
          "properties": {
            "vision": { "type": "boolean" },
            "audio": { "type": "boolean" }
          }
        },
        "reasoning": {
          "type": "object",
          "additionalProperties": false,
          "required": ["supported", "explicit_tokens"],
          "properties": {
            "supported": { "type": "boolean" },
            "explicit_tokens": { "type": "boolean" }
          }
        },
        "use_case": {
          "type": "object",
          "additionalProperties": false,
          "properties": {
            "thinking": { "type": "boolean" },
            "coding": { "type": "boolean" },
            "instruct": { "type": "boolean" },
            "mixture_of_experts": { "type": "boolean" }
          }
        }
      }
    },
    "modelLimits": {
      "type": "object",
      "additionalProperties": false,
      "properties": {
        "context_window_tokens": { "type": ["number", "null"] },
        "max_output_tokens": { "type": ["number", "null"] },
        "max_images": { "type": ["number", "null"] },
        "max_batch_size": { "type": ["number", "null"] }
      }
    },
    "modelPerformance": { "type": "object", "additionalProperties": true },
    "modelConfiguration": { "type": "object", "additionalProperties": true },
    "inferenceServerRecord": {
      "type": "object",
      "additionalProperties": false,
      "required": ["server_id", "display_name"],
      "properties": {
        "server_id": { "type": "string", "minLength": 1 },
        "display_name": { "type": "string", "minLength": 1 },
        "active": { "type": "boolean" },
        "archived": { "type": "boolean" },
        "created_at": { "type": "string" },
        "updated_at": { "type": "string" },
        "archived_at": { "type": ["string", "null"] }
      }
    },
    "serverRuntime": {
      "type": "object",
      "additionalProperties": true,
      "required": ["retrieved_at", "source", "server_software", "api"],
      "properties": {
        "retrieved_at": { "type": "string" },
        "source": { "type": "string", "enum": ["server", "client", "mixed"] },
        "server_software": {
          "type": "object",
          "additionalProperties": false,
          "required": ["name", "version", "build"],
          "properties": {
            "name": { "type": "string", "minLength": 1 },
            "version": { "type": ["string", "null"] },
            "build": { "type": ["string", "null"] }
          }
        },
        "api": {
          "type": "object",
          "additionalProperties": false,
          "required": ["schema_family", "api_version"],
          "properties": {
            "schema_family": {
              "type": "array",
              "minItems": 1,
              "items": { "type": "string", "enum": ["openai-compatible", "ollama", "anthropic", "gemini", "custom"] },
              "uniqueItems": true
            },
            "api_version": { "type": ["string", "null"] }
          }
        }
      }
    },
    "serverEndpoints": {
      "type": "object",
      "additionalProperties": false,
      "required": ["base_url", "health_url", "https"],
      "properties": {
        "base_url": { "type": "string", "pattern": "^https?://" },
        "health_url": { "type": ["string", "null"] },
        "https": { "type": "boolean" }
      }
    },
    "serverAuth": {
      "type": "object",
      "additionalProperties": false,
      "required": ["type", "header_name", "token_env"],
      "properties": {
        "type": { "type": "string", "enum": ["none", "bearer", "basic", "oauth", "custom"] },
        "header_name": { "type": "string" },
        "token_env": { "type": ["string", "null"] },
        "token": { "type": ["string", "null"] },
        "token_present": { "type": "boolean" }
      }
    },
    "serverCapabilities": {
      "type": "object",
      "additionalProperties": false,
      "required": ["server", "generation", "multimodal", "reasoning", "concurrency", "enforcement"],
      "properties": {
        "server": {
          "type": "object",
          "additionalProperties": false,
          "required": ["streaming", "models_endpoint"],
          "properties": {
            "streaming": { "type": "boolean" },
            "models_endpoint": { "type": "boolean" }
          }
        },
        "generation": {
          "type": "object",
          "additionalProperties": false,
          "required": ["text", "json_schema_output", "tools", "embeddings"],
          "properties": {
            "text": { "type": "boolean" },
            "json_schema_output": { "type": "boolean" },
            "tools": { "type": "boolean" },
            "embeddings": { "type": "boolean" }
          }
        },
        "multimodal": { "type": "object", "additionalProperties": true },
        "reasoning": { "type": "object", "additionalProperties": true },
        "concurrency": { "type": "object", "additionalProperties": true },
        "enforcement": { "type": "string", "enum": ["server"] }
      }
    },
    "serverDiscovery": {
      "type": "object",
      "additionalProperties": true,
      "required": ["retrieved_at", "ttl_seconds", "model_list"],
      "properties": {
        "retrieved_at": { "type": "string" },
        "ttl_seconds": { "type": "number" },
        "model_list": { "type": "object", "additionalProperties": true }
      }
    }
  }
}
